{
	"adapter_sha256": "fd09946d8995076ba05945492d6118d68a895927d7c68f1b60c4dcb58c227263",
	"candidate_id": "task-environment-candidate-v1-preactjs-preact-4436-bec4640c6021c687476d15a44ffb80fce9f454984a7b8eef87f7ee3842beadcc",
	"candidate_sha256": "574ded844f1deddd2ce6289a2cc0a026770c2d69c02195b03fa83d3f3ecd9cb0",
	"created_at": "2026-07-20T00:52:26.581Z",
	"dataset_lock_id": "dataset-v1-g-20260718-135934-066a8f5b6f6b-e451237925674fc6",
	"evaluator_image": {
		"local_image_id": "sha256:462abc986637966030f884d6c815ee28a8ad9254183fb804dfdb5b3ab69a3afc",
		"platform": "linux/amd64",
		"provenance_sha256": "605df09763c171d23656bf6e0066553ec77f5826dde5318e217f938ee4b3ddc3"
	},
	"filesystem_profile_sha256": "be9ee2c8063607fdf8ea068eab039bc82c3a756fd3a2019ff5a771926ed97b17",
	"instance_id": "preactjs__preact-4436",
	"lock_id": "task-environment-v1-preactjs-preact-4436-510083886610d7cc",
	"lock_type": "task_environment",
	"official_image_source_lock_id": "official-images-v1-set-26-140ebe01ca57c662",
	"resource_profile": {
		"cpu_count": 4,
		"memory_bytes": 8589934592,
		"network_mode": "none",
		"pids_limit": 512,
		"read_only_root_filesystem": true
	},
	"sanitizer_sha256": "3d1cbbea005c97f65b0abdedfc5d1fbb1fcd5386eff8270c5036626f56466695",
	"schema_version": "v1",
	"seal_sha256": "510083886610d7cca8362b82d68d36b6256f9873f5b44ce66c36905bb41e1277",
	"source_image": {
		"local_image_id": "sha256:494623047cb6cff8256e679402d5e64c9784a678d0b83d2b12d615e8ae1da056",
		"platform": "linux/amd64",
		"repository_digest": "swebench/sweb.eval.x86_64.preactjs_1776_preact-4436@sha256:494623047cb6cff8256e679402d5e64c9784a678d0b83d2b12d615e8ae1da056"
	},
	"verification": {
		"completed_at": "2026-07-20T00:52:26.581Z",
		"equivalence_passed": true,
		"evidence_sha256": "c315debbac277389197815697747ff1c1237a10292c83f25795fd610b3db5b55",
		"factory_probe_passed": true,
		"factory_probe_report_sha256": "cf7e647adb43bffaa20c9d967665b61e76434fe7ebf71ab566fc9b6d37b954d8",
		"security_profile_passed": true
	},
	"worker_image": {
		"local_image_id": "sha256:04dea62fe186fdedc3f2bf62ae2fb8f88e9d168d79da98a80c2464ed35166c2e",
		"platform": "linux/amd64",
		"provenance_sha256": "c183ecdf1cb9fe28e8ea3b805726bd676a59b8b303582710f73c00a0ef4b93a2"
	}
}
