{
	"adapter_sha256": "fd09946d8995076ba05945492d6118d68a895927d7c68f1b60c4dcb58c227263",
	"candidate_id": "task-environment-candidate-v1-axios-4738-503bd1d1ef758351acf22c91567a5d6c571303a899b151c4b91dbd6d9362352c",
	"candidate_sha256": "0baad49de8a8ce9bb1abc785f61d040d2fe1382ab0fc79f857a3db41d9f29199",
	"created_at": "2026-07-20T00:52:26.581Z",
	"dataset_lock_id": "dataset-v1-g-20260718-135934-066a8f5b6f6b-e451237925674fc6",
	"evaluator_image": {
		"local_image_id": "sha256:1510defe2fabf68686fa331ca95c059216b86326d4a926b973ebf5304b7e956e",
		"platform": "linux/amd64",
		"provenance_sha256": "1c047cf49e14a3cdba07ccec0773226b0b661a34f49791e81acb5464e8f0d517"
	},
	"filesystem_profile_sha256": "5e78dd045ea750f4714c5c36ddb7f9e393289d2f6f768b6ce39978345f689c70",
	"instance_id": "axios__axios-4738",
	"lock_id": "task-environment-v1-axios-4738-a24566335f5f211c",
	"lock_type": "task_environment",
	"official_image_source_lock_id": "official-images-v1-set-26-140ebe01ca57c662",
	"resource_profile": {
		"cpu_count": 4,
		"memory_bytes": 8589934592,
		"network_mode": "none",
		"pids_limit": 512,
		"read_only_root_filesystem": true
	},
	"sanitizer_sha256": "3d1cbbea005c97f65b0abdedfc5d1fbb1fcd5386eff8270c5036626f56466695",
	"schema_version": "v1",
	"seal_sha256": "a24566335f5f211cbe210cbaa24cad77df4c7a5df74777a4abb07e67a32d8a9a",
	"source_image": {
		"local_image_id": "sha256:299ed8da35c832e3692cb22279f7b01c61a25ca66b38c4465e0bffb026b976a7",
		"platform": "linux/amd64",
		"repository_digest": "swebench/sweb.eval.x86_64.axios_1776_axios-4738@sha256:299ed8da35c832e3692cb22279f7b01c61a25ca66b38c4465e0bffb026b976a7"
	},
	"verification": {
		"completed_at": "2026-07-20T00:52:26.581Z",
		"equivalence_passed": true,
		"evidence_sha256": "a78dd40dafd3b83d2e94e2531ab8c55f9c063a8fa47c0b81a13c02ab5c91ece0",
		"factory_probe_passed": true,
		"factory_probe_report_sha256": "43d75f5860d446f7069fb1019c01746f28bdb2cddf31cda1e03f75354bb9d685",
		"security_profile_passed": true
	},
	"worker_image": {
		"local_image_id": "sha256:2b914629b60a661f9d24e1e143b1cb1f5c1341af363a0947898425e3d27df1d1",
		"platform": "linux/amd64",
		"provenance_sha256": "0495519523aba27163ee9675ab69fd5ba9ada759eff6c19f48d9f06b70d8d75d"
	}
}
