{
	"adapter_sha256": "fd09946d8995076ba05945492d6118d68a895927d7c68f1b60c4dcb58c227263",
	"candidate_id": "task-environment-candidate-v1-preactjs-preact-4152-a98dfd582c3558730b982526da81833d39095a5951e0a09e79b5e26283e42e02",
	"candidate_sha256": "cdfa95e8eb95ed762b57f50b380b9c3c7a7a557ab5ad249567ad3132c4a7d786",
	"created_at": "2026-07-20T00:52:26.581Z",
	"dataset_lock_id": "dataset-v1-g-20260718-135934-066a8f5b6f6b-e451237925674fc6",
	"evaluator_image": {
		"local_image_id": "sha256:d484a354e1987e51cd62ee8fcbbf016871347a78626bd4c1d167eddfadbbcf5d",
		"platform": "linux/amd64",
		"provenance_sha256": "e565620da0aea151f27eb578d4e15114c4916e3d82a43f50c9ff365b86b3f797"
	},
	"filesystem_profile_sha256": "a721e95288b638b25a98d2e19209c4cd087772c4e2f8521df1b1836a1bf1b200",
	"instance_id": "preactjs__preact-4152",
	"lock_id": "task-environment-v1-preactjs-preact-4152-0817cb9296f81bd8",
	"lock_type": "task_environment",
	"official_image_source_lock_id": "official-images-v1-set-26-140ebe01ca57c662",
	"resource_profile": {
		"cpu_count": 4,
		"memory_bytes": 8589934592,
		"network_mode": "none",
		"pids_limit": 512,
		"read_only_root_filesystem": true
	},
	"sanitizer_sha256": "3d1cbbea005c97f65b0abdedfc5d1fbb1fcd5386eff8270c5036626f56466695",
	"schema_version": "v1",
	"seal_sha256": "0817cb9296f81bd8b485f3745a6213bb67281bdba874ac5e1498712465af770e",
	"source_image": {
		"local_image_id": "sha256:e1c39630835e0539678fb9ae23ad1f74a77a8448fbda36f31c38d4b95df4e963",
		"platform": "linux/amd64",
		"repository_digest": "swebench/sweb.eval.x86_64.preactjs_1776_preact-4152@sha256:e1c39630835e0539678fb9ae23ad1f74a77a8448fbda36f31c38d4b95df4e963"
	},
	"verification": {
		"completed_at": "2026-07-20T00:52:26.581Z",
		"equivalence_passed": true,
		"evidence_sha256": "299d99c91928fb4d9999a38cef72741dcc0db190317f258f91953cbf46db9ff1",
		"factory_probe_passed": true,
		"factory_probe_report_sha256": "3b62e4f9b519c64baae8267cda54d03f2331bb1af5b7f28d6c2f5732135025ad",
		"security_profile_passed": true
	},
	"worker_image": {
		"local_image_id": "sha256:207c3746f0ec9cc0e3172164a0c7d2a4d53f264890e59598e87c47a85a3e6caa",
		"platform": "linux/amd64",
		"provenance_sha256": "84d673c233ac486187a4fa09825d97b4869b8f8875f6458da3725e555b3e62e6"
	}
}
