{
	"adapter_sha256": "fd09946d8995076ba05945492d6118d68a895927d7c68f1b60c4dcb58c227263",
	"candidate_id": "task-environment-candidate-v1-mrdoob-three.js-27395-e3fc3ebbb746ffabcb620f567a5792b623d24483493614c8aeb563c6e595b572",
	"candidate_sha256": "c88cf9e2ce54416d5fa61089a3d2548ed46f66634f82bd56d58203d8ebf2486b",
	"created_at": "2026-07-20T00:52:26.581Z",
	"dataset_lock_id": "dataset-v1-g-20260718-135934-066a8f5b6f6b-e451237925674fc6",
	"evaluator_image": {
		"local_image_id": "sha256:55d3e2ac7af3b3493fb3ab3a3f1197d4a367180881ad5750885800f5291f7028",
		"platform": "linux/amd64",
		"provenance_sha256": "0cba169dd445939d5e24b0344b26932fd1af215f4151942c6e3eea2b38ce86a1"
	},
	"filesystem_profile_sha256": "ac1a282465a9bf07ec443e552cbcf53ab19d34c3ed4c10e1db765544a08f9a6e",
	"instance_id": "mrdoob__three.js-27395",
	"lock_id": "task-environment-v1-mrdoob-three.js-27395-f95db753696f988b",
	"lock_type": "task_environment",
	"official_image_source_lock_id": "official-images-v1-set-26-140ebe01ca57c662",
	"resource_profile": {
		"cpu_count": 4,
		"memory_bytes": 8589934592,
		"network_mode": "none",
		"pids_limit": 512,
		"read_only_root_filesystem": true
	},
	"sanitizer_sha256": "3d1cbbea005c97f65b0abdedfc5d1fbb1fcd5386eff8270c5036626f56466695",
	"schema_version": "v1",
	"seal_sha256": "f95db753696f988b40f2f1eb4c7c19781644f61cd5a0ff942d26cd0a660d627f",
	"source_image": {
		"local_image_id": "sha256:23eaa1e98a8c2c3e4341bfb7e277e8f5b3b5aaf122bf3109ae483db6706ca99f",
		"platform": "linux/amd64",
		"repository_digest": "swebench/sweb.eval.x86_64.mrdoob_1776_three.js-27395@sha256:23eaa1e98a8c2c3e4341bfb7e277e8f5b3b5aaf122bf3109ae483db6706ca99f"
	},
	"verification": {
		"completed_at": "2026-07-20T00:52:26.581Z",
		"equivalence_passed": true,
		"evidence_sha256": "439ac32aedb4b726d605618ca5ffd9ccef996730f169da5b84962336de19a62a",
		"factory_probe_passed": true,
		"factory_probe_report_sha256": "b1b73a5fc56622a0e6c3c5d20b21971d3b5006acd6b4e597a6832060c30c6912",
		"security_profile_passed": true
	},
	"worker_image": {
		"local_image_id": "sha256:02267f1a11e68a450b2f838a8071d4c40957b1ad982a2e4fd1c4f5406ea63a40",
		"platform": "linux/amd64",
		"provenance_sha256": "2afc111ca2f5d1f4de0b2a2e22820e5f29248efdce60a37e208c52edfcaf042e"
	}
}
