{
	"adapter_sha256": "fd09946d8995076ba05945492d6118d68a895927d7c68f1b60c4dcb58c227263",
	"candidate_id": "task-environment-candidate-v1-preactjs-preact-3345-e64d8dbd54458159b91bcc2d12098a7c0b410cb6eb73f5d95ba40dfd922825f1",
	"candidate_sha256": "9bbc82062b1ec555a09f89b7b900e1ea6d3b63803d5d7c04aa0129d4f3e75fdd",
	"created_at": "2026-07-20T00:52:26.581Z",
	"dataset_lock_id": "dataset-v1-g-20260718-135934-066a8f5b6f6b-e451237925674fc6",
	"evaluator_image": {
		"local_image_id": "sha256:6ff64f9f9fa41c6cbf254a855d8a260e94025bd88e70b239bf4d8c51066b634d",
		"platform": "linux/amd64",
		"provenance_sha256": "599d4ed8fe42a7309d904ab6f10feb7cc1fe9e9e8877a4398669c3f5ff6ce1fe"
	},
	"filesystem_profile_sha256": "00b3ae11bb8fffdd463d1e632e7cdbc0cf119500f8b76f1f167c91049ae7bc71",
	"instance_id": "preactjs__preact-3345",
	"lock_id": "task-environment-v1-preactjs-preact-3345-e4879005d2f932ed",
	"lock_type": "task_environment",
	"official_image_source_lock_id": "official-images-v1-set-26-140ebe01ca57c662",
	"resource_profile": {
		"cpu_count": 4,
		"memory_bytes": 8589934592,
		"network_mode": "none",
		"pids_limit": 512,
		"read_only_root_filesystem": true
	},
	"sanitizer_sha256": "3d1cbbea005c97f65b0abdedfc5d1fbb1fcd5386eff8270c5036626f56466695",
	"schema_version": "v1",
	"seal_sha256": "e4879005d2f932edcb566342ea3a9dd498c16e0911902694b0aa98b66327e47d",
	"source_image": {
		"local_image_id": "sha256:35a3d9d43d9725ecab1460bd0e192bc0923a9adf0c5bc1c742e66de53b0d9fa5",
		"platform": "linux/amd64",
		"repository_digest": "swebench/sweb.eval.x86_64.preactjs_1776_preact-3345@sha256:35a3d9d43d9725ecab1460bd0e192bc0923a9adf0c5bc1c742e66de53b0d9fa5"
	},
	"verification": {
		"completed_at": "2026-07-20T00:52:26.581Z",
		"equivalence_passed": true,
		"evidence_sha256": "d1207e8a0d191d4e5708ef7a9a8e44f6d295a71276d768cbc5eadefc1ce999d2",
		"factory_probe_passed": true,
		"factory_probe_report_sha256": "6884ac27c5dbc577063d6e257d2034d8957a1cb6aa5c0adb35004952ac0ddd2f",
		"security_profile_passed": true
	},
	"worker_image": {
		"local_image_id": "sha256:3c674e05094c9f0a9d818ef7fcad68984a261c9d269f94a54353d0dbb17186d2",
		"platform": "linux/amd64",
		"provenance_sha256": "da0f02217e72258840515bf1c88847c171b675e190a0f6338020f00fac01b4eb"
	}
}
