{
	"adapter_sha256": "fd09946d8995076ba05945492d6118d68a895927d7c68f1b60c4dcb58c227263",
	"candidate_id": "task-environment-candidate-v1-preactjs-preact-4182-28d601a1b328ebc9988879f395fdefcd05763a6051cb2ab1e795ef3119aa6f32",
	"candidate_sha256": "21b8324fb161df8c0f103de0aa485f71c1f2360e88a25b8feb3a5893fbd91275",
	"created_at": "2026-07-20T00:52:26.581Z",
	"dataset_lock_id": "dataset-v1-g-20260718-135934-066a8f5b6f6b-e451237925674fc6",
	"evaluator_image": {
		"local_image_id": "sha256:635a78ca99228a961fbd6f13a2d3d820577071d8279e10bf1b8d39394cc726ef",
		"platform": "linux/amd64",
		"provenance_sha256": "0e7753531cf4b86736615182852cae8ad6dab29614b29767e26b0fb418b2ac10"
	},
	"filesystem_profile_sha256": "88318086c997f804a2d701b41df763b49d5a32078b83134bdb0ee1cd0249bfeb",
	"instance_id": "preactjs__preact-4182",
	"lock_id": "task-environment-v1-preactjs-preact-4182-d5654d563b803a5c",
	"lock_type": "task_environment",
	"official_image_source_lock_id": "official-images-v1-set-26-140ebe01ca57c662",
	"resource_profile": {
		"cpu_count": 4,
		"memory_bytes": 8589934592,
		"network_mode": "none",
		"pids_limit": 512,
		"read_only_root_filesystem": true
	},
	"sanitizer_sha256": "3d1cbbea005c97f65b0abdedfc5d1fbb1fcd5386eff8270c5036626f56466695",
	"schema_version": "v1",
	"seal_sha256": "d5654d563b803a5c7be3baeff1421444d4adb925b73adf7ed140bdacc2ffadae",
	"source_image": {
		"local_image_id": "sha256:0a6dc282eded0ceb8f0638624ac78e64819df7222e1799357712f92e648adbcd",
		"platform": "linux/amd64",
		"repository_digest": "swebench/sweb.eval.x86_64.preactjs_1776_preact-4182@sha256:0a6dc282eded0ceb8f0638624ac78e64819df7222e1799357712f92e648adbcd"
	},
	"verification": {
		"completed_at": "2026-07-20T00:52:26.581Z",
		"equivalence_passed": true,
		"evidence_sha256": "c631ce12b42a345ee0f1869e6548e3eeee87f422e806d39741bf5fbbf2bf8937",
		"factory_probe_passed": true,
		"factory_probe_report_sha256": "f731c8aa0b61dc8ac79721a378ed04462cd79f361e070173090c8fe19e3d62e3",
		"security_profile_passed": true
	},
	"worker_image": {
		"local_image_id": "sha256:afa5e4be26b2741a57e767e719ebea9b5bc860761e488f056932d82aad12ffc9",
		"platform": "linux/amd64",
		"provenance_sha256": "5f2c4e5beb68a0c6cd1f6390dae1bb87134a3061695f14f075937eef29690de9"
	}
}
