{
	"adapter_sha256": "fd09946d8995076ba05945492d6118d68a895927d7c68f1b60c4dcb58c227263",
	"candidate_id": "task-environment-candidate-v1-preactjs-preact-2927-2fe89dada6ed45ac0e690da28b293dbb6cc216d075f0426f88067207f89adc3b",
	"candidate_sha256": "618ddf351fc5da2dba3c1d93f2307bcb9643ab38b4638c5b96c461465678b224",
	"created_at": "2026-07-20T00:52:26.581Z",
	"dataset_lock_id": "dataset-v1-g-20260718-135934-066a8f5b6f6b-e451237925674fc6",
	"evaluator_image": {
		"local_image_id": "sha256:e83b3b766d8ab33b7d9ecd335e0c95c9215e8c81044c26d7da1552b4f7489921",
		"platform": "linux/amd64",
		"provenance_sha256": "f2283e65f2f6ea9953bb429696a3a479ff2dc8eb512a33c28dce01e4f2bc1fe9"
	},
	"filesystem_profile_sha256": "38404180683f5ed1514c4185e48cb47ac7b0e196bbba3f280cee550ad5c685ad",
	"instance_id": "preactjs__preact-2927",
	"lock_id": "task-environment-v1-preactjs-preact-2927-bdffe8e6ee68596b",
	"lock_type": "task_environment",
	"official_image_source_lock_id": "official-images-v1-set-26-140ebe01ca57c662",
	"resource_profile": {
		"cpu_count": 4,
		"memory_bytes": 8589934592,
		"network_mode": "none",
		"pids_limit": 512,
		"read_only_root_filesystem": true
	},
	"sanitizer_sha256": "3d1cbbea005c97f65b0abdedfc5d1fbb1fcd5386eff8270c5036626f56466695",
	"schema_version": "v1",
	"seal_sha256": "bdffe8e6ee68596bed8ea4e789387df66690bbec34b360fae65be3429ebe5987",
	"source_image": {
		"local_image_id": "sha256:9de1fb715e02f5824c6c1fbf468423828f24607d0e94a36a146cffe4bffb15b0",
		"platform": "linux/amd64",
		"repository_digest": "swebench/sweb.eval.x86_64.preactjs_1776_preact-2927@sha256:9de1fb715e02f5824c6c1fbf468423828f24607d0e94a36a146cffe4bffb15b0"
	},
	"verification": {
		"completed_at": "2026-07-20T00:52:26.581Z",
		"equivalence_passed": true,
		"evidence_sha256": "692155276c33fbc59e9e85761ce87ddba64db175c40b91ab657ea5dc848a728f",
		"factory_probe_passed": true,
		"factory_probe_report_sha256": "5883e6f67d034f5fc6ad86d72e0c251792aee4a076750c9b1fba59f831067328",
		"security_profile_passed": true
	},
	"worker_image": {
		"local_image_id": "sha256:1cbfdf62cff1ce2999d03400e05f17d5435ad229e7f93f86c8837c60f2d4f16b",
		"platform": "linux/amd64",
		"provenance_sha256": "121e71ea2ffea883c6f6367bf38c9f42c456f82be780f6eebce0b9cf1f6d4ef0"
	}
}
